word,pos,synset_id,gloss,lemma_names
ತೆಗೆ,verb,37115,ಗಂಟು ಅಥವಾ ತೊಡಕು ಮೊದಲಾದವುಗಳನ್ನು ಬಿಡಿಸುವುದು,"[""ಬಿಚ್ಚು"", ""ತೆಗೆ"", ""ಬಿಡಿಸು""]"
ತೆಗೆ,verb,5596,ಯಾವುದಾದರೂ ವಸ್ತುವಿನ ಮೇಲೆ ಇರುವ ಧೂಳು ಅಥವಾ ಕೊಳೆ ತೆಗೆಯುವುದು,"[""ತೆಗೆ"", ""ಹೊಡೆ""]"
ನಿಲ್ಲಿಸು,verb,10641,ರೀತಿ ಅಥವಾ ರೂಢಿಗಳನ್ನು ಅಂತ್ಯಗೊಳಿಸುವ ಕ್ರಿಯೆ,"[""ಸಮಾಪ್ತಿಗೊಳಿಸು"", ""ಮುಗಿಸು"", ""ನಿಲ್ಲಿಸು"", ""ಅಂತ್ಯಗೊಳಿಸು""]"
ನಿಲ್ಲಿಸು,verb,10745,ಅಡ್ಡಿ ಅಥವಾ ಅಡಚಣೆಯನ್ನು ಮಾಡು,"[""ಮುಚ್ಚು"", ""ತಡೆ"", ""ನಿಲ್ಲಿಸು"", ""ಅಡ್ಡಿ_ಮಾಡು"", ""ಅಡಚಣೆ_ಮಾಡು""]"
ನಿಲ್ಲಿಸು,verb,10746,ಬಂಧನಗೊಳಿಸುವುದು ಅಥವಾ ನಿರ್ಭಂದವನ್ನು ಹೇರುವುದು,"[""ತಡೆ"", ""ನಿಲ್ಲಿಸು"", ""ಅಡ್ಡಿಮಾಡು"", ""ನಿಷೇಧಿಸು"", ""ನಿರೋಧಿಸು"", ""ನಿರ್ಭಂದಿಸು""]"
ನಿಲ್ಲಿಸು,verb,11130,ಚಲನೆಯಲ್ಲಿರುವ ವಸ್ತುವಿನ ಗತಿಯನ್ನು ನಿಲ್ಲಿಸುವುದು,"[""ನಿಲ್ಲಿಸು""]"
ನಿಲ್ಲಿಸು,verb,11595,ಯಾವುದಾದರು ಜಾಗಕ್ಕೆ ತಲುಪಿಸು,"[""ನಿಲ್ಲಿಸು"", ""ತಲುಪು""]"
ನಿಲ್ಲಿಸು,verb,11606,ಯಾವುದೋ ಒಂದರ ಆಧಾರದ ಮೇಲೆ ನಿಂತಿರುವ ಪ್ರಕ್ರಿಯೆ,"[""ನಿಲ್ಲಿಸು"", ""ಹಿಡಿದು_ನಿಲ್ಲಿಸು"", ""ತಡೆಹಿಡಿ"", ""ತಡೆಹಿಡಿದು_ನಿಲ್ಲಿಸು""]"
ನಿಲ್ಲಿಸು,verb,12225,ಯಾರೋ ಒಬ್ಬರನ್ನು ಮುಂದೆ ಹೋಗದಂತೆ ತಡೆಯುವ ಪ್ರಕ್ರಿಯೆ,"[""ನಿಲ್ಲಿಸು""]"
ನಿಲ್ಲಿಸು,verb,12226,ಹಿಂದಿನಿಂದ ನಡೆದುಕೊಂಡು ಬಂದ ಪದ್ದತಿಯನ್ನು ನಿಲ್ಲಿಸುವ ಪ್ರಕ್ರಿಯೆ,"[""ನಿಷೇದಿಸು"", ""ರದ್ದು_ಮಾಡು"", ""ನಿಲ್ಲಿಸು""]"
ನಿಲ್ಲಿಸು,verb,12227,ಕೊಡುವುದಿಲ್ಲ,"[""ನಿಲ್ಲಿಸು"", ""ತಡೆಹಿಡಿ"", ""ಕೊಡದೆಯಿರು""]"
ನಿಲ್ಲಿಸು,verb,13992,ನಿಶ್ಚಯಿಸಿದ ಸಮಯಕ್ಕಿಂತ ಹೆಚ್ಚಿನ ಸಮಯವನ್ನು ತೆಗೆದುಕೊಳ್ಳುವ ಪ್ರಕ್ರಿಯೆ,"[""ಸ್ಥಗಿತಗೊಳಿಸು"", ""ನಿಂತು_ಹೋಗು"", ""ನಿಲ್ಲಿಸು""]"
ನಿಲ್ಲಿಸು,verb,2528,ತಡ ತಡೆದು ಮಾತನಾಡುವ ಕ್ರಿಯೆ,"[""ನಿಲ್ಲಿಸು"", ""ನಿಲ್ಲು"", ""ತಾಳು""]"
ನಿಲ್ಲಿಸು,verb,34516,ಇಷ್ಟಕ್ಕೆ ನಿಂತು ಹೋಗುವ ಅಥವಾ ಮುಂದೆ ಹೋಗದೇ ಇರುವುದು (ವಿಶೇಷವಾಗಿ ಯಾವುದಾದರು ಆಟ ಅಥವಾ ಪಂದ್ಯಗಳಲ್ಲಿ),"[""ನಿಂತುಹೋಗು"", ""ನಿಲ್ಲಿಸು""]"
ನಿಲ್ಲಿಸು,verb,34883,ಮಾಡಲು ಹೋರಟಿರುವ ಅಥವಾ ಮಾಡುತ್ತಿರುವ ಕೆಲಸವನ್ನು ನಿಲ್ಲಿಸುವ ಪ್ರಕ್ರಿಯೆ,"[""ನಿಲ್ಲಿಸು""]"
ನಿಲ್ಲಿಸು,verb,38316,ಚನ್ನಾಗಿ ನಡೆಯುತ್ತಿರುವ ಕೆಲಸವನ್ನು ಗುಪ್ತವಾಗಿ ನಿಲ್ಲಿಸುವ ಪ್ರಕ್ರಿಯೆ,"[""ನಿಲ್ಲಿಸು"", ""ಅಡ್ಡಗಟ್ಟು"", ""ತಡೆಯೊಡ್ಡು"", ""ಅಡಚಣೆ_ಮಾಡು""]"
ನಿಲ್ಲಿಸು,verb,9925,ನಿಲ್ಲಿಸುವ ಕೆಲವನ್ನು ಬೇರೆಯವರಿಂದ ಮಾಡಿಸು,"[""ನಿಲ್ಲಿಸು""]"
ಹಾಳು_ಮಾಡು,verb,12177,ವ್ಯಕ್ತಿಯ ಗುಣ ಮೊದಲಾದವುಗಳನ್ನು ನಾಶ ಮಾಡುವುದು,"[""ಕುಗ್ಗಿಸು"", ""ನಾಶ_ಮಾಡು"", ""ಹಾಳು_ಮಾಡು"", ""ಮಣ್ಣು_ಪಾಲು_ಮಾಡು"", ""ಭಂಗ_ಮಾಡು""]"
ಹಾಳು_ಮಾಡು,verb,13826,ಯಾವುದನ್ನಾದರು ಹಾಳು ಮಾಡುವುದಕ್ಕೆ ಹೇಳುವ ಪ್ರಕ್ರಿಯೆ,"[""ಹಾಳು_ಮಾಡು"", ""ನೆಲಸಮ_ಮಾಡು"", ""ಹಾಳು_ಮಾಡು"", ""ನೆಲಸಮ_ಮಾಡು""]"
ಹಾಳು_ಮಾಡು,verb,15072,ಯಾವುದೋ ಒಂದು ಪದಾರ್ಥದಿಂದ ಸ್ವಾಭಾವಿಕ ಗುಣ ಅಥವಾ ಸ್ವಭಾವವನ್ನೇ ನಾಶ ಮಾಡುವ ಪ್ರಕ್ರಿಯೆ,"[""ಹಾಳು_ಮಾಡು"", ""ಹಾಳು_ಮಾಡು"", ""ಹಾನಿ_ಮಾಡು"", ""ಹಾನಿ_ಮಾಡು"", ""ನಾಶ_ಮಾಡು"", ""ನಾಶ_ಮಾಡು""]"
ಹಾಳು_ಮಾಡು,verb,15073,ಬಟ್ಟೆಯನ್ನು ಹೊಲಿಯುವ ಸಮಯದಲ್ಲಿ ಅದನ್ನು ಸರಿಯಾಗಿ ಹೊಲಿಯದೆ ಕೆಡಿಸುವ ಪ್ರಕ್ರಿಯೆ,"[""ಹಾಳು_ಮಾಡು"", ""ಕೆಡಿಸು""]"
ಹಾಳು_ಮಾಡು,verb,15074,ವಸ್ತುಗಳನ್ನು ಕೆಡಿಸುವ ಕ್ರಿಯೆ,"[""ಹಾಳು_ಮಾಡು"", ""ಕೆಡಿಸು""]"
ಹಾಳು_ಮಾಡು,verb,15075,"ನೀತಿ, ಸಂಸ್ಕಾರ ಮುಂತಾದವುಗಳನ್ನು ಕಲಿಸದೆ ಭ್ರಷ್ಟರಾಗುವಂತೆ ಮಾಡುವ ಕ್ರಿಯೆ","[""ಹಾಳು_ಮಾಡು"", ""ಕೆಡಿಸು"", ""ಕೆಟ್ಟ_ದಾರಿ_ತೋರಿಸು"", ""ಕೆಟ್ಟದನ್ನು_ಹೇಳು"", ""ಕೆಟ್ಟದನ್ನು_ಹೇಳಿಕೊಡು"", ""ಕೆಟ್ಟದನ್ನು_ಕಲಿಸು""]"
ಹಾಳು_ಮಾಡು,verb,15076,ಹೆಂಗಸಿನ ಮಾನ ಭಂಗ ಮಾಡುವ ಪ್ರಕ್ರಿಯೆ,"[""ಕೆಡಿಸು"", ""ಮಾನಭಂಗ_ಮಾಡು"", ""ಹಾಳು_ಮಾಡು""]"
ಹಾಳು_ಮಾಡು,verb,22025,ಯಾವುದೋ ಒಂದು ನಿಧಾನವಾಗಿ ನಶಿಸಿ ಹೋಗುವ ಅಥವಾ ಕಡಿಮೆಯಾಗುತ್ತಾ ಹೋಗುವ ಕ್ರಿಯೆ,"[""ನಾಶ_ಮಾಡು"", ""ಹಾಳು_ಮಾಡು"", ""ಹಾನಿ_ಮಾಡು"", ""ನಾಶ_ಮಾಡು"", ""ಹಾಳು_ಮಾಡು"", ""ಹಾನಿ_ಮಾಡು""]"
ಹಾಳು_ಮಾಡು,verb,32293,ಮನುಷ್ಯ ಇದ್ದ ಹಾಗೆ ರೋಗ ತಗುಲುವ ಪ್ರಕ್ರಿಯೆ,"[""ನಾಶ_ಮಾಡು"", ""ಹಾಳು_ಮಾಡು""]"
ಹಾಳು_ಮಾಡು,verb,3432,ಯಾವುದೇ ವಸ್ತು ಅಥವಾ ಸಂಗತಿಯನ್ನು ಇರುವ ಸ್ಥಿತಿಗಿಂತ ಇನ್ನಷ್ಟು ಕೆಳಸ್ಥಿತಿಗೆ ಒಯ್ಯುವ ಪ್ರಕ್ರಿಯೆ,"[""ಕೆಡಿಸು"", ""ಹಾಳುಮಾಡು"", ""ಹಾಳು_ಮಾಡು""]"
ಹಾಳು_ಮಾಡು,verb,35204,ಪೂರ್ಣವಾಗಿ ನಷ್ಟ ಮಾಡುವುದು ಅಥವಾ ನಾಶ ಮಾಡುವ ಪ್ರಕ್ರಿಯೆ,"[""ನಾಶ_ಮಾಡು"", ""ಹಾಳು_ಮಾಡು""]"
ಹಾಳು_ಮಾಡು,verb,36034,"ವಸ್ತು, ಸಮಯ ಮೊದಲಾದವುಗಳನ್ನು ಸರಿಯಾದ ರೀತಿಯಲ್ಲಿ ಉಪಯೋಗಿಸದೆ ಇರುವ ಪ್ರಕ್ರಿಯೆ","[""ಹಾಳು_ಮಾಡು"", ""ನಾಶಮಾಡು"", ""ಕೆಡಿಸು""]"
ಹಾಳು_ಮಾಡು,verb,36173,"ಬಾಂಬು, ಕ್ಷಿಪಣಿ ಇತ್ಯಾದಿಗಳಿಂದ ನಾಶ ಮಾಡುವ ಪ್ರಕ್ರಿಯೆ","[""ನಾಶ_ಮಾಡು"", ""ಹಾಳು_ಮಾಡು"", ""ಧ್ವಂಸ_ಮಾಡು""]"
ಹಾಳು_ಮಾಡು,verb,36675,ಯಾವುದೋ ಒಂದು ಕೆಲಸವನ್ನು ಕಠಿಣವಾಗಿ ಮತ್ತು ಅಸಂಭವದ ಹಾಗೆ ಮಾಡುವ ಪ್ರಕ್ರಿಯೆ,"[""ಹಾಳು_ಮಾಡು""]"
ಹಾಳು_ಮಾಡು,verb,7644,ದ್ವಂಸ ಮಾಡು ಅಥವಾ ನಷ್ಟ-ಭ್ರಷ್ಟಗೊಳಿಸು,"[""ನಾಶ_ಮಾಡು"", ""ನಷ್ಟ_ಮಾಡು"", ""ನಾಶಗೊಳಿಸು"", ""ದ್ವಂಸ_ಮಾಡು"", ""ಹಾಳು_ಮಾಡು"", ""ಉಧ್ವಸ್ತಮಾಡು""]"
ಮಾಡು,verb,11879,ಜನರು ವಿದ್ಯಾಭ್ಯಾಸ ಮಾಡಿ ಒಂದು ಹಂತಕ್ಕೆ ತಲುಪುವ ಪ್ರಕ್ರಿಯೆ,"[""ಮಾಡು""]"
ಮಾಡು,verb,11959,ಬಾಡಿಗೆಗೆ ವಾಹವನ್ನು ತೆಗೆದು ಕೊಳ್ಳುಅಥವಾ ಮಾಡಿಕೊ,"[""ಮಾಡು"", ""ಮಾಡಿಕೊ"", ""ಮಾಡಿಕೊಳ್ಳು_ಬಾಡಿಗೆಗೆ_ತೆಗೊ""]"
ಮಾಡು,verb,11967,ಅತುರ ಆತುರವಾಗಿ ಮಾಡುವ ಪ್ರಕ್ರಿಯೆ,"[""ಮಾಡು""]"
ಮಾಡು,verb,27508,ಯಾರೋ ಒಬ್ಬರಿಗೆ ನಿಶ್ಚಿತ ಗುಣ ನೀಡುವ ಅಥವಾ ಗುಣ ಅಥವಾ ಲಕ್ಷಣಗಳನ್ನು ಯುಕ್ತ ಪಡಿಸುವ ಪ್ರಕ್ರಿಯೆ,"[""ಮಾಡು""]"
ಮಾಡು,verb,27520,"ಯಾವುದೇ ಕೆಲಸ, ವಸ್ತು ಮುಂತಾದುವುಗಳಿಗೆ ಉಪಯೋಗಕ್ಕೆ ಬರುವ ಪ್ರಕ್ರಿಯೆ","[""ಮಾಡು"", ""ತಯಾರಿಸು""]"
ಮಾಡು,verb,27521,ಯಾವುದೋ ಒಂದು ಪರಿಸ್ಥಿ ಉಂಟಾಗುವಂತೆ ಮಾಡುವ ಅಥವಾ ಯಾವುದೋ ಭಾವನೆ ಹುಟ್ಟುವಂತೆ ಮಾಡುವ ಪ್ರಕ್ರಿಯೆ,"[""ಮಾಡು""]"
ಮಾಡು,verb,27523,ಉನ್ನತಿ ಅಥವಾ ಅವನತಿಯಲ್ಲು ಸಹಾಯ ಮಾಡುವ ಪ್ರಕ್ರಿಯೆ,"[""ಮಾಡು""]"
ಮಾಡು,verb,27599,ಹುದುಗು ಬರುವಂತೆ ಮಾಡುವ ಪ್ರಕ್ರಿಯೆ,"[""ಕಿಣ್ವಕರಣ"", ""ಮಾಡು"", ""ಹುದುಗು_ಬರುವಂತೆ_ಮಾಡು""]"
ಮಾಡು,verb,27688,ಯಾವುದೋ ಒಂದು ಲೋಹಕ್ಕೆ ಆಕಾರ ನೀಡು ಅಥವಾ ಉಪಯೋಗಿಸುವಂತೆ ಮಾಡು ಅಥವಾ ಸುಧಾರಣೆ ಅಥವಾ ಉನ್ನತವಾಗಿ ಮಾಡುವ ಪ್ರಕ್ರಿಯೆ,"[""ಮಾಡು"", ""ತಯಾರಿಸು""]"
ಮಾಡು,verb,27799,ಯಾವುದೇ ಘಟನೆ ಇತ್ಯಾದಿ ಘಟಿಸುವ ಕಾರಣ ಅದರ ಫಲಿತಾಂಶದ ರೂಪ ಹೊರಬರುವ ಪ್ರಕ್ರಿಯೆ,"[""ಮಾಡು""]"
ಮಾಡು,verb,3295,ಯಾವುದಾದರೊಂದು ಕ್ರಿಯೆಯನ್ನು ನಡೆಸುವ ಪ್ರಕ್ರಿಯೆ,"[""ಮಾಡು"", ""ಕೆಲಸಮಾಡು"", ""ಕಾರ್ಯಮಾಡು""]"
ಮಾಡು,verb,34299,ವಾಸ ಸ್ಥಾನವನ್ನು ನಿರ್ಮಾಣ ಮಾಡು,"[""ಮಾಡು"", ""ತಯಾರಿ_ಮಾಡು"", ""ನಿರ್ಮಾಣ_ಮಾಡು"", ""ಕಟ್ಟು""]"
ಮಾಡು,verb,35030,ಉಪಯೋಗಕ್ಕೆ ಬರುವ ವಸ್ತುಗಳ ಬಗೆಗೆ ಚಿಂತನೆ ಮಾಡುವ ಪ್ರಕ್ರಿಯೆ,"[""ಮಾಡು""]"
ಮಾಡು,verb,4115,ಯಾವುದೇ ಕೆಲಸವನ್ನು ಆರಂಭಿಸಿ ಮುಗಿಸುವವರೆಗಿನ ಕ್ರಿಯೆ,"[""ಮಾಡು"", ""ಮಾಡಿದ_ಕೆಲಸ"", ""ಮಾಡಿದ_ಕೆಲಸ"", ""ರಚಿಸು"", ""ತಯಾರಿಸು"", ""ಕೆಲಸವನ್ನು_ನಿರ್ವಹಿಸು"", ""ಕೆಲಸವನ್ನು_ನಿರ್ವಹಿಸು""]"
ಬರು,verb,11863,ತೂಕದಲ್ಲಿ ಬರುವ ಅಥವಾ ಹಿಡಿಯುವಂತಹ,"[""ಬರು"", ""ಹಿಡಿ"", ""ತೂಗು""]"
ಬರು,verb,11881,ಕಾಲ ಅಥವಾ ಸಮಯ ಪ್ರಾರಂಭಿಸುವ ಪ್ರಕ್ರಿಯೆ,"[""ಬರು""]"
ಬರು,verb,11882,ಯಾವುದಾದರು ಭಾವನೆ ಅಥವಾ ಅವಸ್ಥೆ ಉತ್ಪನ್ನವಾಗುವುದು,"[""ಆಗು"", ""ಬರು""]"
ಬರು,verb,11884,ಖರೀದಿಸುವುದರಿಂದ ಯಾವುದಾದರು ವಸ್ತು ಪ್ರಾಪ್ತಿಯಾಗು,"[""ಬರು""]"
ಬರು,verb,12183,ನೆನಪಿಗೆ ಬರುವುದು ಅಥವಾ ಸ್ಮರಣೆ ಬರುವುದು,"[""ಬರು""]"
ಬರು,verb,12185,ಬಾಡಿಗೆಗೆ ನೀಡು,"[""ನೀಡು"", ""ಬರು""]"
ಬರು,verb,12188,ಶರೀರದ ಮೇಲೆ ಗುಳ್ಳೆಗಳು ಏಳುವ ಪ್ರಕ್ರಿಯೆ,"[""ಎಳು"", ""ಬರು""]"
ಬರು,verb,12505,ಉತ್ಪನ್ನವಾಗು ಅಥವಾ ಬರುವಂತಹ ಪ್ರಕ್ರಿಯೆ,"[""ಬರು""]"
ಬರು,verb,12511,"ಅಭ್ಯಾಸವಾಗುವ, ಚಟವಾಗುವ ಪ್ರಕ್ರಿಯೆ","[""ಹುಟ್ಟು"", ""ಬರು""]"
ಬರು,verb,28203,ಒಂದು ನಿಶ್ಚಿತ ಸ್ಥಾನದಲ್ಲಿ ಯಾವುದೋ ಒಂದು ಇರುವ ಪ್ರಕ್ರಿಯೆ,"[""ಬರು""]"
ಬರು,verb,3437,ಒಂದು ಸ್ಥಾನದಿಂದ ಬಂದು ಇನ್ನೊಂದು ಸ್ಥಾನದಲ್ಲಿ ಉಪಸ್ಥಿತಿಯಾಗುವುದು,"[""ಬರು"", ""ಆಗಮಿಸು"", ""ತಲುಪು""]"
ಬರು,verb,37549,ಮಣ್ಣನು ಅಗೆಯುವಾಗ ಯಾವುದೋ ಒಂದು ದೊರೆಯುವ ಪ್ರಕ್ರಿಯೆ,"[""ಬರು""]"
ಬರು,verb,7452,ಯಾವುದೇ ವ್ಯಕ್ತಿ ಅಥವಾ ವಸುವನ್ನು ಒಂದು ಸ್ಥಳದಿಂದ ಇನ್ನೊಂದು ಸ್ಥಳಕ್ಕೆ ಹೋಗಿ ಸೇರುವುದು,"[""ತಲುಪುವುದು"", ""ತಲುಪಿಸುವುದು"", ""ಬರು"", ""ಇಡು""]"
ರಕ್ಷಿಸು,verb,11184,ನಮ್ಮ ರಕ್ಷಣೆ ಅಥವಾ ಅಧಿಕಾರದಲ್ಲಿ ಇಟ್ಟಿರುವಂತಹ,"[""ಇಡು"", ""ರಕ್ಷಿಸು"", ""ಇಟ್ಟುಕೊಳ್ಳು""]"
ರಕ್ಷಿಸು,verb,11506,ವಿಪತ್ತು ಅಥವಾ ಕಷ್ಟಕ್ಕೆ ಸಿಲುಕದಂತೆ ಮಾಡುವುದು,"[""ರಕ್ಷಿಸು"", ""ಉಳಿಸು"", ""ಕಾಪಾಡು""]"
ರಕ್ಷಿಸು,verb,14195,ಯಾವುದಾದರು ವಸ್ತುವನ್ನು ರಕ್ಷಣೆ ಮಾಡುವ ಪ್ರಕ್ರಿಯೆ,"[""ರಕ್ಷಿಸು"", ""ರಕ್ಷಣೆ_ಮಾಡು"", ""ರಕ್ಷಣೆ_ಮಾಡು""]"
ರಕ್ಷಿಸು,verb,27374,ನಷ್ಟ ಅಥವಾ ಅಂತ್ಯ ಅಥವಾ ಭಂಗವಾಗುವುದರಿಂದ ರಕ್ಷಿಸುವ ಅಥವಾ ಸುರಕ್ಷಿತವಾಗಿರುವ ಇಡುವ ಪ್ರಕ್ರಿಯೆ,"[""ಕಾಪಾಡು"", ""ರಕ್ಷಿಸು""]"
ರಕ್ಷಿಸು,verb,27473,"ಆತಿಕ್ರಮಣ ಬೆಟೆಯಾಡುವುದು, ಮೀನು ಹಿಡಿಯುವುದು ಇತ್ಯಾದಿ ಮಾಡದೆ ದೂರ ಉಳಿಯುವುದು ಅಥವಾ ಉಪಯೋಗಿಸದೆ ಇರುವ ಪ್ರಕ್ರಿಯೆ","[""ಉಳಿಸು"", ""ಸಂರಕ್ಷಿಸು"", ""ರಕ್ಷಿಸು""]"
ರಕ್ಷಿಸು,verb,3457,ಮೃತ ಶರೀರಕ್ಕೆ ಜೀವನ್ನು ಬರಿಸುವುದು,"[""ಬದುಕಿಸು"", ""ರಕ್ಷಿಸು"", ""ಕಾಪಾಡು""]"
ರಕ್ಷಿಸು,verb,35493,ಮಧ್ಯದಲ್ಲಿ ಬಂದು ಅಥವಾ ಹಾಳಾಗುತ್ತಿರುವ ಸ್ಥಿತಿಯನ್ನು ಮತ್ತು ಇನ್ನೂ ಹಾಳಾಗುವುದನ್ನು ತಡೆಯುವುದು,"[""ಸಂಭಾಳಿಸು"", ""ರಕ್ಷಿಸು"", ""ಹಿಡಿದಿಡು"", ""ನಿರ್ವಹಿಸು""]"
ರಕ್ಷಿಸು,verb,35984,ಯಾವುದನ್ನಾದರು ಅಥವಾ ಯಾರನ್ನಾದರೂ ಉಳಿಸುವ ಕ್ರಿಯೆ,"[""ರಕ್ಷಣೆ_ಮಾಡು"", ""ರಕ್ಷಿಸು"", ""ಉಳಿಸು""]"
ರಕ್ಷಿಸು,verb,38319,ಕಷ್ಟ ಅಥವಾ ಸಂಕಟದಿಂದ ಯಾರನ್ನಾದರೂ ಮುಕ್ತಗೊಳಿಸುವ ಪ್ರಕ್ರಿಯೆ,"[""ಪಾರು_ಮಾಡು"", ""ಪಾರುಮಾಡು"", ""ಕಾಪಾಡು"", ""ರಕ್ಷಿಸು"", ""ಮುಕ್ತರಾಗು"", ""ಮುಕ್ತಿಗೊಳಿಸು""]"
ರಕ್ಷಿಸು,verb,4692,ಪೋಷಣೆ ಅಥವಾ ರಕ್ಷಣೆಯಂತಹ ಕೆಲಸ ಮಾಡುವುದು,"[""ಪೋಷಿಸು"", ""ರಕ್ಷಿಸು""]"
ರಕ್ಷಿಸು,verb,9140,ತೊಂದರೆಯಿಂದ ಕಾಪಾಡುವುದು,"[""ಸಂಭಾಲಿಸು"", ""ಸಂರಕ್ಷಿಸು"", ""ಸಂರಕ್ಷೆ_ಮಾಡು"", ""ರಕ್ಷಿಸು"", ""ಉಳಿಸು""]"
ರಕ್ಷಿಸು,verb,9156,ಯಾರೋ ಒಬ್ಬ ವ್ಯಕ್ತಿ ಅಥವಾ ವಸ್ತು ಮೊದಲಾದವುಗಳ ಮೇಲೆ ಧ್ಯಾನವನ್ನು ನೀಡು,"[""ಸಂಬಾಳಿಸು"", ""ಪಾಲನೆಮಾಡು"", ""ಉಳಿಸು"", ""ರಕ್ಷಿಸು"", ""ಸಂರಕ್ಷಿಸು_ನಿಭಾಯಿಸು""]"
ರಕ್ಷಿಸು,verb,9192,ಯಾವುದೋ ಒಂದು ವಸ್ತುವನ್ನು ಇಡುವ ಕ್ರಿಯೆ,"[""ಇಡು"", ""ರಕ್ಷಿಸು"", ""ಇಟ್ಟುಕೊಳ್ಳು""]"
ಆಗು,verb,11582,ಸಂಬಂಧ ಅಥವಾ ಬಾಂಧವ್ಯದಲ್ಲಿ ಏನಾದರೂ ಆಗುವುದು,"[""ಆಗು""]"
ಆಗು,verb,11593,ಯಾವುದೋ ಒಂದರ ಬಗೆಗೆ ಅನುಭವವಾಗುವ ಪ್ರಕ್ರಿಯೆ,"[""ಆಗು"", ""ಅನುಭವವಾಗು"", ""ಅನಿಸು""]"
ಆಗು,verb,11860,"ವರ್ಷ, ಮಾಸ ಮೊದಲಾದವುಗಳು ಆರಂಭವಾಗುವುದು","[""ಆಗು"", ""ಪ್ರಾರಂಭವಾಗು"", ""ಆರಂಭಿಸು""]"
ಆಗು,verb,11877,"ಯಾವುದೇ ಪದವಿ, ಸ್ಥಾನ ಮುಂತಾದವುಗಳ ವರೆಗೂ ತಲುಪುವ ಪ್ರಕ್ರಿಯೆ","[""ತಲುಪು"", ""ಆಗು"", ""ಸೇರು""]"
ಆಗು,verb,11882,ಯಾವುದಾದರು ಭಾವನೆ ಅಥವಾ ಅವಸ್ಥೆ ಉತ್ಪನ್ನವಾಗುವುದು,"[""ಆಗು"", ""ಬರು""]"
ಆಗು,verb,11883,"ಬಟ್ಟೆ, ಒಡವೆ ಮೊದಲಾದವುಗಳನ್ನು ಶರೀರಕ್ಕೆ ಸರಿಯಾಗಿ ಕೂರುವುದು","[""ಆಗು"", ""ಸರಿಯಾಗು""]"
ಆಗು,verb,12174,"ಚಿಂತೆ, ಹುಷಾರಿಲ್ಲದ ಕಾರಣದಿಂದಾಗಿ ಶರೀರ ಕೃಷವಾಗುವುದು ಅಥವಾ ಯಾರಾದರೂ ಸಾಯುವುದು","[""ಆಗು"", ""ಉಂಟಾಗು""]"
ಆಗು,verb,27519,ವರ್ತಮಾನದ ಸ್ಥಿತಿಯಲ್ಲಿ ಅಂತರ ತರುವ ಅಥವಾ ಮೇಲು-ಕೀಳು ಬೇದ ಮಾಡುವ ಪ್ರಕ್ರಿಯೆ,"[""ತರು"", ""ಆಗು""]"
ಆಗು,verb,36203,ಪ್ರಯೋಗ ಮತ್ತು ವ್ಯವಹಾರದ ದೃಷ್ಟಿಯಿಂದ ಮಾಡುವ ಕ್ರಿಯೆಯ ಅಕರ್ಮಕ ರೂಪದ ಕೆಲಸವನ್ನು ನೀಡುವುಂತಹ ತುಂಬಾ ಪ್ರಚಲಿತ ಮತ್ತು ಪ್ರಸಿದ್ಧವಾದ ಕ್ರಿಯೆ,"[""ಆಗು""]"
ಆಗು,verb,4918,ಘಟನೆಯ ರೂಪದಲ್ಲಿ ಆಗುವುದು,"[""ಆಗು"", ""ಆದ"", ""ಸಂಭವಿಸು"", ""ಸಂಭವಿಸಿದ""]"
ಆಗು,verb,5023,ಯಧಾರ್ಥವಾಗಿ ಸಿದ್ಧಿಯಾಗುವುದು,"[""ಆಗು"", ""ಸಂಭವಿಸು""]"
ಆಗು,verb,7132,ರೂಪವನ್ನು ನೀಡುವುದು,"[""ಆಗು"", ""ಸಿದ್ಧವಾಗು"", ""ತಯಾರಿ_ಮಾಡು""]"
ಕಠಿಣವಾದ,adjective,11241,ಯಾವುದೋ ಸುಲಭವಿಲ್ಲ,"[""ಕಠಿಣವಾದ"", ""ವಿಕಟವಾದ"", ""ಪ್ರಚಂಡವಾದ"", ""ಕ್ಲಿಷ್ಟವಾದ"", ""ವಿಷಮ"", ""ದೊಡ್ಡ""]"
ಕಠಿಣವಾದ,adjective,13388,ತುಂಬಾ ಕಠೋರ ಅಥವಾ ಬಿರುಸಾದಂತಹ,"[""ಕಠಿಣ"", ""ಕಠಿಣವಾದ"", ""ಕಠಿಣವಾದಂತ"", ""ಕಠಿಣವಾದಂತಹ""]"
ಕಠಿಣವಾದ,adjective,13855,ಯಾವುದು ಸುಲಭವಾಗಿ ಅಥವಾ ಸಹಜತೆಯಿಂದ ತಿಳಿದುಕೊಳ್ಳಲಾಗುವುದಿಲ್ಲವೋ,"[""ಗೂಢವಾದ"", ""ಗೂಢವಾದಂತ"", ""ಗೂಢವಾದಂತಹ"", ""ಕಠಿಣವಾದ"", ""ಕಠಿಣವಾದಂತ"", ""ಕಠಿಣವಾದಂತಹ"", ""ಕ್ಲಿಷ್ಟವಾದ"", ""ಕ್ಲಿಷ್ಟವಾದಂತ"", ""ಕ್ಲಿಷ್ಟವಾದಂತಹ""]"
ಕಠಿಣವಾದ,adjective,13856,ಬೇಗ ಹಿಡಿಯುವುದಕ್ಕೆ ಸಿಗದಂತಹ ಅಥವಾ ಯಾವುದನ್ನು ಹಿಡಿಯಲು ಕಠಿಣವಾಗಿದೆಯೋ,"[""ಗೂಢವಾದ"", ""ಗೂಢವಾದಂತ"", ""ಗೂಢವಾದಂತಹ"", ""ಕಠಿಣವಾದ"", ""ಕಠಿಣವಾದಂತ"", ""ಕಠಿಣವಾದಂತಹ"", ""ಕ್ಲಿಷ್ಟವಾದ"", ""ಕ್ಲಿಷ್ಟವಾದಂತ"", ""ಕ್ಲಿಷ್ಟವಾದಂತಹ""]"
ಕಠಿಣವಾದ,adjective,16286,ಯಾವುದೋ ಒಂದು ಪೂರ್ಣವಾಗಿ ಅಥವಾ ಸುಲಭವಾಗಿ ಅರ್ಥವಾಗುವುದಿಲ್ಲವೋ,"[""ಕಠಿಣವಾದ"", ""ಕಠಿಣವಾದಂತ"", ""ಕಠಿಣವಾದಂತಹ"", ""ಕಷ್ಟವಾದ"", ""ಕಷ್ಟವಾದಂತ"", ""ಕಷ್ಟವಾದಂತಹ"", ""ಕ್ಲಿಷ್ಟವಾದ"", ""ಕ್ಲಿಷ್ಟವಾದಂತ"", ""ಕ್ಷಿಷ್ಟವಾದಂತಹ""]"
ಕಠಿಣವಾದ,adjective,22109,ಯಾವುದನ್ನು ಪೂರ್ಣ ಮಾಡುವುದು ಕಠಿಣವೋ,"[""ಕಠಿಣವಾದ"", ""ಕಠಿಣವಾದಂತ"", ""ಕಠಿಣವಾದಂತಹ""]"
ಕಠಿಣವಾದ,adjective,23070,ಯಾವುದು ಬಹು ಬೇಗನೆ ಅರ್ಥಮಾಡಿಕೊಳ್ಳಲು ಸಾಧ್ಯವಿಲ್ಲವೋ,"[""ಕಠಿಣವಾದ"", ""ಕಠಿಣವಾದಂತ"", ""ಕಠಿಣವಾದಂತಹ"", ""ಸುಲಭವಲ್ಲದ"", ""ಸುಲಭವಲ್ಲದಂತ"", ""ಸುಲಭವಲ್ಲದಂತಹ"", ""ಕಷ್ಟಕರವಾದ"", ""ಕಷ್ಟಕರವಾದಂತ"", ""ಕಷ್ಟಕರವಾದಂತಹ""]"
ಕಠಿಣವಾದ,adjective,2347,ಯಾವುದೋ ಒಂದು ಪ್ರದೇಶಕ್ಕೆ ಹೋಗಲು ಯೋಗ್ಯವಲ್ಲವೋ,"[""ಕಠಿಣ"", ""ಕಠಿಣವಾದ"", ""ಕಠಿಣವಾದಂತ"", ""ಕಠಿಣವಾದಂತಹ"", ""ಕಷ್ಟವಾದ"", ""ಕಷ್ಟವಾದಂತ"", ""ಕಷ್ಟವಾದಂತಹ"", ""ಕ್ಲಿಷ್ಟವಾದ"", ""ಕ್ಲಿಷ್ಟವಾದಂತ"", ""ಕ್ಲಿಷ್ಟವಾದಂತಹ"", ""ದುರ್ಗಮ"", ""ದುರ್ಗಮವಾದ"", ""ದುರ್ಗಮವಾದಂತ"", ""ದುರ್ಗಮವಾದಂತಹ"", ""ಅಗಮ್ಯ"", ""ಅಗಮ್ಯವಾದ"", ""ಅಗಮ್ಯವಾದಂತ"", ""ಅಗಮ್ಯವಾದಂತಹ"", ""ದುರ್ಗಮ್ಯ"", ""ದುರ್ಗಮ್ಯವಾದ"", ""ದುರ್ಗಮ್ಯವಾದಂತ"", ""ದುರ್ಗಮ್ಯವಾದಂತಹ"", ""ಅನಾಗಮ್ಯ"", ""ಅನಾಗಮ್ಯವಾದ"", ""ಅನಾಗಮ್ಯವಾದಂತ"", ""ಅನಾಗಮ್ಯವಾದಂತಹ""]"
ಕಠಿಣವಾದ,adjective,26844,ಒಂದು ಇನ್ನೊಂದಕ್ಕೆ ಸೇರಿಸಿ ಗಂಟು ಹಾಕಿಕೊಂಡಿರುವಂತಹ,"[""ಜಠಿಲ"", ""ಜಠಿಲವಾದ"", ""ಜಠಿಲವಾದಂತಹ"", ""ಕಠಿಣ"", ""ಕಠಿಣವಾದ"", ""ಕಠಿಣವಾದಂತಹ""]"
ಕಠಿಣವಾದ,adjective,3194,"ಯಾವುದೇ ವಸ್ತು ಸಂಗತಿಯನ್ನು ಪಳಗಿಸಲು, ಸಡಿಲಿಸಲು, ಅಲುಗಾಡಿಸಲು, ಒಡೆಯಲು ಮುಂತಾದ ಕ್ರಿಯೆಗಳು ಸಾಧ್ಯವಾಗದೇ ಇರುವ ಸ್ಥಿತಿ","[""ಅಸಾಧ್ಯ"", ""ಅಸಾಧ್ಯವಾದ"", ""ಅಸಾಧ್ಯವಾದಂತ"", ""ಅಸಾಧ್ಯವಾದಂತಹ"", ""ಕಠಿಣವಾದ"", ""ಕಠಿಣವಾದಂತ"", ""ಕಠಿಣವಾದಂತಹ""]"
ಕಠಿಣವಾದ,adjective,37113,ಮಂದ ಗತಿಯಲ್ಲಿ ನಡೆಯುತ್ತಿರುವ ಕಾರಣದಿಂದ ತುಂಬಾ ಸಮಯ ತೆಗೆದುಕೊಳ್ಳುವಂತಹ,"[""ಪ್ರಯಾಸದ"", ""ಕಠಿಣವಾದ"", ""ಪ್ರಯಾಸಪೂರಿತ"", ""ಶ್ರಮಭರಿತ"", ""ಶ್ರಮಪೂರಿತ"", ""ಕಷ್ಟಕರ"", ""ಕಷ್ಟವಾದ"", ""ಕಷ್ಟಕರವಾದ""]"
