pair_id,section,section_word,sentence1,sentence2,target_word,target_key,label_raw,label,sense_id_1,sense_id_2,label_corrected,pair_source
pair_0121,word,ಲೇ (lē),ಟೇಬಿಲ್ ಮೇಲೆ ನೀರು ಲೇದೆ.,ಹೊಡೆದಿದ್ದರಿಂದ ಹೆಣ್ಣಿನ ಲೋಹಿತ ಲೇದೆ.,ಲೇ,ಲೇ,1,1,2,2.0,1,
pair_0122,word,ಲೇ (lē),ಬೀಜ ಲೇಯಿ.,ಪ್ರಕಾಶ ಲೇದೆ.,ಲೇ,ಲೇ,1,1,3,3.0,1,
pair_0123,word,ಬೆಳೆ (beḷe),ಮಗು ಬೆಳೆಯುತ್ತಿದೆ.,ಆತನ ಉತ್ತರ ದಾಯಿತ್ವ ಬೆಳೆಯುತ್ತಿದೆ.,ಬೆಳೆ,ಬೆಳೆ,1,1,1,1.0,1,
pair_0124,word,ಬೆಳೆ (beḷe),ಅನ್ನ ಬೆಳೆಯುವುದು ರೈತಿಕೆಯ ಪ್ರಧಾನ ಕೆಲಸ.,ತರಕಾರಿ ಬೆಳೆಯಿರಿ.,ಬೆಳೆ,ಬೆಳೆ,1,1,2,2.0,1,
pair_0125,word,ಬೆಳೆ (beḷe),ಮಗುವಿನ ಮನ ಬೆಳೆಯುವುದು ಮುಖ್ಯ.,ಶಕ್ತಿ ಬೆಳೆಸಿ.,ಬೆಳೆ,ಬೆಳೆ,1,1,3,3.0,1,
pair_0126,word,ತೆಗೆ (tege),ನನ್ನ ಹಸ್ತ ತೆಗೆ.,ಹೋಗಿ ಮೇಲಿನ ತಗರು ತೆಗೆದುಕೊ.,ತೆಗೆ,ತೆಗೆ,0,0,1,2.0,0,
pair_0127,word,ತೆಗೆ (tege),ನೆಲದಿಂದ ಪಿಸು ತೆಗೆದುಕೊ.,ಗುರಿನೆ ಬಾರಣವನ್ನು ತೆಗೆದುಕೊಳ್ಳಿ.,ತೆಗೆ,ತೆಗೆ,0,0,3,4.0,0,
pair_0128,word,ಕೊಡು (koḍu),ಆನೆಗೆ ಒಣಹೂವು ಕೊಡಿ.,ದೇವರಿಗೆ ಹೂವು ಕೊಡುವುದು ಸಂಪ್ರದಾಯ.,ಕೊಡು,ಕೊಡು,0,0,1,2.0,0,
pair_0129,word,ಕೊಡು (koḍu),ಶತ್ರುವಿಗೆ ಭೀಷಣ ಪ್ರಹಾರ ಕೊಡುತ್ತೆ.,ಗಿರುಗಳ ಹಾಕುಮಾರಿ ಬೆಳ್ಳಳಿ ಕೊಡುತ್ತವೆ.,ಕೊಡು,ಕೊಡು,0,0,3,4.0,0,
pair_0130,word,ನೋಡು (nōḍu),ಆಕಾಶ ನೋಡಿ.,ಸಿನೆಮಾ ನೋಡುವುದು ಆನಂದ.,ನೋಡು,ನೋಡು,0,0,1,2.0,0,
pair_0131,word,ನೋಡು (nōḍu),ನನ್ನ ಸ್ನೇಹಿತ ನೀಡೆ ನೋಡುತ್ತೆ.,ಸರಿಪೊತ್ತು ನೋಡಿ.,ನೋಡು,ನೋಡು,0,0,3,4.0,0,
pair_0132,word,ಸಾಕು (sāku),ಇಷ್ಟು ಸಾಕು.,ಹಸು ಸಾಕುವುದು ಅಸಾಧಾರಣ.,ಸಾಕು,ಸಾಕು,0,0,1,2.0,0,
pair_0133,word,ಸಾಕು (sāku),ಈ ನೋವು ಸಾಕಲಾರೆ.,ಗುರುಗಳನ್ನು ಸಾಕಿದೆ.,ಸಾಕು,ಸಾಕು,0,0,3,2.0,0,
pair_0134,word,ಧರಿಸು (dharisu),ಹೊಸ ಬಟ್ಟೆ ಧರಿಸಿ.,ಅಸ್ತ್ರ ಧರಿಸಿ ಯುದ್ಧಕ್ಕೆ ಬಂದರು.,ಧರಿಸು,ಧರಿಸು,0,0,1,2.0,0,
pair_0135,word,ಧರಿಸು (dharisu),ಭೂಮಿಯ ಸಾಕಷ್ಟು ಸೋಂಕುಗಳನ್ನು ಧರಿಸಿದೆ.,ಮುಖವಾಣಿ ಧರಿಸಿ.,ಧರಿಸು,ಧರಿಸು,0,0,3,1.0,0,
pair_0136,word,ಬರು (baru),ನಾಳೆ ನನ್ನ ಮನೆಗೆ ಬಾರು.,ರೈಲು ಸಮಯಕ್ಕೆ ಬರುತ್ತಿದೆ.,ಬರು,ಬರು,0,0,1,2.0,0,
pair_0137,word,ಬರು (baru),ಇದೇ ಆಕಸ್ಮಾತ್ ಘಟನೆ ಕಾಲೇ ಕಾಲೇ ಬರುತ್ತದೆ.,ಅವನು ಅರಸನಾಗಿ ಬರುತ್ತೀಯ.,ಬರು,ಬರು,0,0,3,4.0,0,
pair_0138,word,ಹೋಗು (hōgu),ಪರೀಕ್ಷೆಗೆ ಹೋಗಿ.,"ಮುಂದೆ ಹೋಗಿ, ಜಾರುವುದು ಹೋಗುತ್ತೆ.",ಹೋಗು,ಹೋಗು,0,0,1,2.0,0,
pair_0139,word,ಹೋಗು (hōgu),ಅಲೋಕು ಹೋಗಿ.,ದಿನ ಸರಿಸರಿ ಹೋಗುತ್ತಿದೆ.,ಹೋಗು,ಹೋಗು,0,0,3,4.0,0,
pair_0140,word,ಮಾಡು (māḍu),ಚಿತ್ರ ಸೃಷ್ಟಿ ಮಾಡಿ.,ಕೆಲಸ ಮಾಡಿ.,ಮಾಡು,ಮಾಡು,0,0,1,2.0,0,
pair_0141,word,ಮಾಡು (māḍu),ಆಹಾರ ಮಾಡುತ್ತೇನೆ.,ಸಮಸ್ಯೆ ಮಾಡಿದೆ.,ಮಾಡು,ಮಾಡು,0,0,3,4.0,0,
pair_0142,word,ಹೊಡೆ (hoḍe),ಮೇಜಿನ ಮೇಲೆ ಹೊಡೆಯಿರಿ.,ಬೆಲ್ ಹೊಡೆಯಿರಿ.,ಹೊಡೆ,ಹೊಡೆ,0,0,1,3.0,0,
pair_0143,word,ಕೂಲಿ (kūli),ಪರೋಪಕಾರಿ ಉದ್ದೇಶದಿಂದ ಕೂಲಿ ಮಾಡುತ್ತೆ.,ಮಗುವನ್ನು ಕೂಲಿ ಮಾಡಿ.,ಕೂಲಿ,ಕೂಲಿ,0,0,1,2.0,0,
pair_0144,word,ಕೂಲಿ (kūli),ಪಾರ್ಟಿಗೆ ಮಹತ್ತರ ಕೂಲಿ ಮಾಡಿದೆ.,ನೋವಿನಿಂದ ಕೂಲಿ ಮಾಡಿದಾಳು.,ಕೂಲಿ,ಕೂಲಿ,0,0,3,1.0,0,
pair_0145,word,ಕಾಲೆ (kāle),ಅನ್ನ ಕಾಲೆ ಮಾಡಬೇಡ.,ಹಣ ಕಾಲೆ ಮಾಡುವುದು ನೀತಿಹೀನ.,ಕಾಲೆ,ಕಾಲೆ,0,0,1,2.0,0,
pair_0146,word,ಕಾಲೆ (kāle),ಅಧ್ಯಯನ ಕಾಲೆ ಮಾಡಿದೆ.,ಅವಕಾಶ ಕಾಲೆ ಮಾಡಿದೆ.,ಕಾಲೆ,ಕಾಲೆ,0,0,3,1.0,0,
pair_0147,word,ವಹಿಸು (vahisu),ಸೋವೆಯನ್ನು ವಹಿಸುವುದು ಭಾರೀ.,ರಾಷ್ಟ್ರದ ಜವಾಬ್ದಾರಿ ವಹಿಸುವುದು ಕಷ್ಟ.,ವಹಿಸು,ವಹಿಸು,0,0,1,2.0,0,
pair_0148,word,ವಹಿಸು (vahisu),ಸಂಕಟ ವಹಿಸುವುದು ಧೈರ್ಯದ ಲಕ್ಷಣ.,ಹೊರೆ ವಹಿಸಿ ಹೋಗಿ.,ವಹಿಸು,ವಹಿಸು,0,0,3,1.0,0,
pair_0149,word,ಲೇ (lē),ನೀರು ಲೇಯಿ.,ಟೇಬಿಲ್ ಮೇಲೆ ನೀರು ಲೇದೆ.,ಲೇ,ಲೇ,0,0,1,2.0,0,
pair_0150,word,ಲೇ (lē),ಬೀಜ ಲೇಯಿ.,ಹೊಡೆದಿದ್ದರಿಂದ ಹೆಣ್ಣಿನ ಲೋಹಿತ ಲೇದೆ.,ಲೇ,ಲೇ,0,0,3,2.0,0,
pair_0151,word,ಬೆಳೆ (beḷe),ಮಗು ಬೆಳೆಯುತ್ತಿದೆ.,ಅನ್ನ ಬೆಳೆಯುವುದು ರೈತಿಕೆಯ ಪ್ರಧಾನ ಕೆಲಸ.,ಬೆಳೆ,ಬೆಳೆ,0,0,1,2.0,0,
pair_0152,word,ಬೆಳೆ (beḷe),ಮಗುವಿನ ಮನ ಬೆಳೆಯುವುದು ಮುಖ್ಯ.,ತರಕಾರಿ ಬೆಳೆಯಿರಿ.,ಬೆಳೆ,ಬೆಳೆ,0,0,3,2.0,0,
pair_0153,word,ನಕಲಿ (nakali),ಆ ನಕಲಿ ಚಿತ್ರ ಅಸಾಧಾರಣ ಸಿದ್ಧಿ.,ನಕಲಿ ಪಾಸ್‌ಪೋರ್ಟ್ ಜರಿಮಾನೆಗೆ ಸಾಧ್ಯ.,ನಕಲಿ,ನಕಲಿ,1,1,1,1.0,1,
pair_0154,word,ನಕಲಿ (nakali),ನಕಲಿ ಸಾಕ್ಷ್ಯ ನ್ಯಾಯಾಲಯದ ವಿರುದ್ಧ ರಿವಾಜು.,ನಕಲಿ ವಾದ್ಯತೆ ನಿಖಿಲ ಎಲೆ ಪ್ರತಿ.,ನಕಲಿ,ನಕಲಿ,1,1,2,2.0,1,
pair_0155,word,ಮುಕ್ತ (mukta),ಕೈದಿ ಮುಕ್ತನಾದನು.,ಮುಕ್ತ ಮನೋಭಾವ ಅಗತ್ಯ.,ಮುಕ್ತ,ಮುಕ್ತ,1,1,1,1.0,1,
pair_0156,word,ಮುಕ್ತ (mukta),ಬಂಧನೆಯಿಂದ ಮುಕ್ತನಾದನು.,ಇಲಿಯನ್ನು ಮುಕ್ತ ಮಾಡಿ.,ಮುಕ್ತ,ಮುಕ್ತ,1,1,2,2.0,1,
pair_0157,word,ಗಟ್ಟ (gaṭṭa),ಗಟ್ಟ ಕಲ್ಲು ಚಾಪುತ್ತಾರೆ.,ಮಜ್ಜಿಗೆ ಗಟ್ಟ ಕಕ್ಷ.,ಗಟ್ಟ,ಗಟ್ಟ,1,1,1,1.0,1,
pair_0158,word,ಗಟ್ಟ (gaṭṭa),ಗುರುವು ಗಟ್ಟ ಆಜ್ಞೆಕಾರಿ.,ಗಟ್ಟ ನಿಯಮ ಪಾಲಿಸುತ್ತಾರೆ.,ಗಟ್ಟ,ಗಟ್ಟ,1,1,2,2.0,1,
pair_0159,word,ಗಟ್ಟ (gaṭṭa),ಗಟ್ಟ ಸಮಸ್ಯೆ ಎದುರಾಗಿದೆ.,ಗಟ್ಟ ಅನುಸಾರ ನೋವು.,ಗಟ್ಟ,ಗಟ್ಟ,1,1,3,3.0,1,
pair_0160,word,ಕಬ್ಬಿ (kabbi),ಕಬ್ಬಿ ಬಟ್ಟೆ ಹೊಗಳುವುದಲ್ಲ.,ಕಬ್ಬಿ ಚರ್ಮ ಶೇಕಡೆ.,ಕಬ್ಬಿ,ಕಬ್ಬಿ,1,1,1,1.0,1,
pair_0161,word,ಕಬ್ಬಿ (kabbi),ಕಬ್ಬಿ ಮಾತು ಆಘಾತ ಬಿಡುತ್ತದೆ.,ಕಬ್ಬಿ ವ್ಯವಹಾರ ನಿಜನಾಗಿ ನೋವಾಗಿಸುತ್ತದೆ.,ಕಬ್ಬಿ,ಕಬ್ಬಿ,1,1,2,2.0,1,
pair_0162,word,ನೀಲ (nīla),ನೀಲ ಆಕಾಶ ಮೋಹಕ.,ನೀಲ ವಸ್ತ್ರ ಸುಂದರವಾಗಿದೆ.,ನೀಲ,ನೀಲ,1,1,1,1.0,1,
pair_0163,word,ನೀಲ (nīla),ನೀಲ ಸಂಜೆ ಬರುತ್ತಿದೆ.,ನೀಲ ಮೋಹೆ ಅಂಧಕಾರ.,ನೀಲ,ನೀಲ,1,1,2,2.0,1,
pair_0164,word,ಸಾಧಾರಣ (sādhāraṇa),ಸಾಧಾರಣ ಕುಟುಂಬ ಬದುಕುತ್ತೆ.,ಸಾಧಾರಣ ಮನುಷ್ಯ ಅಸಾಧಾರಣ ಕಾರ್ಯ ಮಾಡಿದನು.,ಸಾಧಾರಣ,ಸಾಧಾರಣ,1,1,1,1.0,1,
pair_0165,word,ಸಾಧಾರಣ (sādhāraṇa),ಸಾಧಾರಣ ಚಿಂತನೆ ಸಕಲ ಜನಕ್ಕು ಅನ್ವಯ.,ಸಾಧಾರಣ ಸತ್ಯ ಪರಿವರ್ತಿತವಾಗಿದೆ.,ಸಾಧಾರಣ,ಸಾಧಾರಣ,1,1,2,2.0,1,
pair_0166,word,ಲೋಭಿ (lobhi),ಲೋಭಿ ಮನುಷ್ಯ ಸದಾ ತೃಪ್ತ ರಹಿತ.,ಲೋಭಿ ಭಾವನೆ ನಾಶ ಮಾಡುತ್ತದೆ.,ಲೋಭಿ,ಲೋಭಿ,1,1,1,1.0,1,
pair_0167,word,ಲೋಭಿ (lobhi),ಶಿಕ್ಷೆಯ ಲೋಭಿ ವಿದ್ಯಾರ್ಥಿ.,ಸಫಲತೆ ಲೋಭಿ ಮನುಷ್ಯ.,ಲೋಭಿ,ಲೋಭಿ,1,1,2,2.0,1,
pair_0168,word,ಹಿರಿಯ (hiriya),ಹಿರಿಯ ವ್ಯಕ್ತಿಯನ್ನು ಸಮ್ಮಾನಿಸಿ.,ಹಿರಿಯ ಪತ್ನಿ ಶಾಂತಿಮತೆ.,ಹಿರಿಯ,ಹಿರಿಯ,1,1,1,1.0,1,
pair_0169,word,ಹಿರಿಯ (hiriya),ಹಿರಿಯ ಅಧಿಕಾರಿ ನಿರ್ದೇಶನ ಮಾಡಿದರು.,ಹಿರಿಯ ಪದ ಪ್ರಾಪ್ತನಾಗಿ.,ಹಿರಿಯ,ಹಿರಿಯ,1,1,2,2.0,1,
pair_0170,word,ಕಿರಿಯ (kiriya),ಕಿರಿಯ ಸಮಸ್ಯೆ ಛಿದ್ರ ಪಟ್ಟು.,ಕಿರಿಯ ವಿವರಣೆ ಸ್ಪಷ್ಟ.,ಕಿರಿಯ,ಕಿರಿಯ,1,1,1,1.0,1,
pair_0171,word,ಕಿರಿಯ (kiriya),ಕಿರಿಯ ಮಗು ನೆಲೆಯಲ್ಲಿ.,ಕಿರಿಯ ವಯಸ್ಸು ಅಮೂಲ್ಯ.,ಕಿರಿಯ,ಕಿರಿಯ,1,1,2,2.0,1,
pair_0172,word,ಪ್ರೀತಿ (prīti),ಪ್ರೀತಿ ಭಾರ್ಯೆ ಮನೆಯ ಸಿಂದೂರ.,ಪ್ರೀತಿ ಭಿತಿಜ ಅವನ ಪ್ರಿಯೆ.,ಪ್ರೀತಿ,ಪ್ರೀತಿ,1,1,1,1.0,1,
pair_0173,word,ಪ್ರೀತಿ (prīti),ಪ್ರೀತಿ ವಿಷಯ ಶಾಸ್ತ್ರ.,ಪ್ರೀತಿ ಔಷಧ ಇಂದ್ರಿಯ.,ಪ್ರೀತಿ,ಪ್ರೀತಿ,1,1,2,2.0,1,
pair_0174,word,ಬೋಳ (bōḷa),ಬೋಳ ಕಾಲೆ ಅವನು ಕೆಟ್ಟ ಪರಿಣಾಮ ಮಾಡಿದನು.,ಬೋಳ ವಿಚಾರಣೆ ಅಸಮರ್ಥನನ್ನು ಸೂಚಿಸುತ್ತದೆ.,ಬೋಳ,ಬೋಳ,1,1,1,1.0,1,
pair_0175,word,ನಕಲಿ (nakali),ಆ ನಕಲಿ ಚಿತ್ರ ಅಸಾಧಾರಣ ಸಿದ್ಧಿ.,ನಕಲಿ ಸಾಕ್ಷ್ಯ ನ್ಯಾಯಾಲಯದ ವಿರುದ್ಧ ರಿವಾಜು.,ನಕಲಿ,ನಕಲಿ,0,0,1,2.0,0,
pair_0176,word,ಮುಕ್ತ (mukta),ಕೈದಿ ಮುಕ್ತನಾದನು.,ಬಂಧನೆಯಿಂದ ಮುಕ್ತನಾದನು.,ಮುಕ್ತ,ಮುಕ್ತ,0,0,1,2.0,0,
pair_0177,word,ಗಟ್ಟ (gaṭṭa),ಗಟ್ಟ ಕಲ್ಲು ಚಾಪುತ್ತಾರೆ.,ಗುರುವು ಗಟ್ಟ ಆಜ್ಞೆಕಾರಿ.,ಗಟ್ಟ,ಗಟ್ಟ,0,0,1,2.0,0,
pair_0178,word,ಗಟ್ಟ (gaṭṭa),ಗಟ್ಟ ಸಮಸ್ಯೆ ಎದುರಾಗಿದೆ.,ಮಜ್ಜಿಗೆ ಗಟ್ಟ ಕಕ್ಷ.,ಗಟ್ಟ,ಗಟ್ಟ,0,0,3,1.0,0,
pair_0179,word,ಕಬ್ಬಿ (kabbi),ಕಬ್ಬಿ ಬಟ್ಟೆ ಹೊಗಳುವುದಲ್ಲ.,ಕಬ್ಬಿ ಮಾತು ಆಘಾತ ಬಿಡುತ್ತದೆ.,ಕಬ್ಬಿ,ಕಬ್ಬಿ,0,0,1,2.0,0,
pair_0180,word,ನೀಲ (nīla),ನೀಲ ಆಕಾಶ ಮೋಹಕ.,ನೀಲ ಸಂಜೆ ಬರುತ್ತಿದೆ.,ನೀಲ,ನೀಲ,0,0,1,2.0,0,
pair_0181,word,ಸಾಧಾರಣ (sādhāraṇa),ಸಾಧಾರಣ ಕುಟುಂಬ ಬದುಕುತ್ತೆ.,ಸಾಧಾರಣ ಸತ್ಯ ಪರಿವರ್ತಿತವಾಗಿದೆ.,ಸಾಧಾರಣ,ಸಾಧಾರಣ,0,0,1,2.0,0,
pair_0182,word,ಲೋಭಿ (lobhi),ಲೋಭಿ ಮನುಷ್ಯ ಸದಾ ತೃಪ್ತ ರಹಿತ.,ಶಿಕ್ಷೆಯ ಲೋಭಿ ವಿದ್ಯಾರ್ಥಿ.,ಲೋಭಿ,ಲೋಭಿ,0,0,1,2.0,0,
pair_0183,word,ಹಿರಿಯ (hiriya),ಹಿರಿಯ ವ್ಯಕ್ತಿಯನ್ನು ಸಮ್ಮಾನಿಸಿ.,ಹಿರಿಯ ಅಧಿಕಾರಿ ನಿರ್ದೇಶನ ಮಾಡಿದರು.,ಹಿರಿಯ,ಹಿರಿಯ,0,0,1,2.0,0,
pair_0184,word,ಕಿರಿಯ (kiriya),ಕಿರಿಯ ಸಮಸ್ಯೆ ಛಿದ್ರ ಪಟ್ಟು.,ಕಿರಿಯ ವಯಸ್ಸು ಅಮೂಲ್ಯ.,ಕಿರಿಯ,ಕಿರಿಯ,0,0,1,2.0,0,
pair_0185,word,ಪ್ರೀತಿ (prīti),ಪ್ರೀತಿ ಭಾರ್ಯೆ ಮನೆಯ ಸಿಂದೂರ.,ಪ್ರೀತಿ ವಿಷಯ ಶಾಸ್ತ್ರ.,ಪ್ರೀತಿ,ಪ್ರೀತಿ,0,0,1,2.0,0,
pair_0186,,,ಪದದ ಅರ್ಥ ತಿಳಿಸಿ.,ಈ ಮಾತುಗಳ ಅರ್ಥ ತೃಪ್ತಿದಾಯಕವಾಗಿದೆ.,ಅರ್ಥ,ಅರ್ಥ,1,1,1,1.0,1,synthetic_examples
pair_0187,,,ಅರ್ಥ ಪಾಲಿಸುವುದು ಅವಶ್ಯಕ.,ಸಭೆ ಅರ್ಥ ಸೂಚಿಸಿದೆ.,ಅರ್ಥ,ಅರ್ಥ,1,1,2,2.0,1,synthetic_examples
pair_0188,,,ಈ ಪ್ರಯೋಗದ ಅರ್ಥ ತಪ್ಪಾದ ವಿಷಯ ಪಕ್ಷೀಕರಿಸುವುದು.,ಯುವಕನ ಅರ್ಥ ಉನ್ನತಿಯಿತು.,ಅರ್ಥ,ಅರ್ಥ,1,1,3,3.0,1,synthetic_examples
pair_0189,,,ಆ ರತ್ನದ ಅರ್ಥ ತುಂಬಾ ಹೆಚ್ಚು.,ಮಾನವ ಜೀವನದ ಅರ್ಥ ಅಮೂಲ್ಯ.,ಅರ್ಥ,ಅರ್ಥ,1,1,4,4.0,1,synthetic_examples
pair_0190,,,ಮಾನವ ಜೀವನದ ಅರ್ಥ ಅಮೂಲ್ಯ.,ಆ ರತ್ನದ ಅರ್ಥ ತುಂಬಾ ಹೆಚ್ಚು.,ಅರ್ಥ,ಅರ್ಥ,1,1,4,4.0,1,synthetic_examples
pair_0191,,,ಕಬ್ಬಿ ಚರ್ಮ ಶೇಕಡೆ.,ಕಬ್ಬಿ ಬಟ್ಟೆ ಹೊಗಳುವುದಲ್ಲ.,ಕಬ್ಬಿ,ಕಬ್ಬಿ,1,1,1,1.0,1,synthetic_examples
pair_0192,,,ಕಬ್ಬಿ ವ್ಯವಹಾರ ನಿಜನಾಗಿ ನೋವಾಗಿಸುತ್ತದೆ.,ಕಬ್ಬಿ ಮಾತು ಆಘಾತ ಬಿಡುತ್ತದೆ.,ಕಬ್ಬಿ,ಕಬ್ಬಿ,1,1,2,2.0,1,synthetic_examples
pair_0193,,,ಕಬ್ಬಿ ಮನುಷ್ಯ ಕಷ್ಟ ಸಹಿಸುತ್ತಾನೆ.,ಕಬ್ಬಿ ನಿರ್ಮಾಣ ದೀರ್ಘಸ್ಥಿರ.,ಕಬ್ಬಿ,ಕಬ್ಬಿ,1,1,3,3.0,1,synthetic_examples
pair_0194,,,ಕಬ್ಬಿ ನಿರ್ಮಾಣ ದೀರ್ಘಸ್ಥಿರ.,ಕಬ್ಬಿ ಮನುಷ್ಯ ಕಷ್ಟ ಸಹಿಸುತ್ತಾನೆ.,ಕಬ್ಬಿ,ಕಬ್ಬಿ,1,1,3,3.0,1,synthetic_examples
pair_0195,,,ಅನಸ್ಥೆಯ ಕರಣ ಕಾರ್ಯಭಾರ ಹೆಚ್ಚು.,ಈ ಘಟನೆಯ ಕರಣ ಎಂದರೆ ನಿರ್ಲಕ್ಷ್ಯತೆ.,ಕರಣ,ಕರಣ,1,1,1,1.0,1,synthetic_examples
pair_0196,,,ಶಿಕ್ಷಣ ಜೀವನ ಸುಧಾರಣೆಯ ಕರಣ.,ಕರ್ನಮ ಭರತಾವಿಯ ಕರಣಗಳು ಅದ್ಭುತವಾಗಿವೆ.,ಕರಣ,ಕರಣ,1,1,2,2.0,1,synthetic_examples
pair_0197,,,ಕರ್ನಮ ಭರತಾವಿಯ ಕರಣಗಳು ಅದ್ಭುತವಾಗಿವೆ.,ಶಿಕ್ಷಣ ಜೀವನ ಸುಧಾರಣೆಯ ಕರಣ.,ಕರಣ,ಕರಣ,1,1,2,2.0,1,synthetic_examples
pair_0198,,,ಪದವಿನ ಕರಣ ವಿಷಯ ವಿಶ್ಲೇಷಿಸಬೇಕು.,ಅಪರ ಕರಣ ತೆರೆದುಕೊಂಡಿದೆ.,ಕರಣ,ಕರಣ,1,1,3,3.0,1,synthetic_examples
pair_0199,,,ಅಪರ ಕರಣ ತೆರೆದುಕೊಂಡಿದೆ.,ಪದವಿನ ಕರಣ ವಿಷಯ ವಿಶ್ಲೇಷಿಸಬೇಕು.,ಕರಣ,ಕರಣ,1,1,3,3.0,1,synthetic_examples
pair_0200,,,ಮಹಾಭಾರತದ ಕಾಲದಲ್ಲಿ ಅನೇಕ ಯುದ್ಧ ನಡೆದವು.,ಕಾಲ ದ್ರುತವಾಗಿ ಹಾದುಹೋಗಿ.,ಕಾಲ,ಕಾಲ,1,1,1,1.0,1,synthetic_examples
pair_0201,,,ಕಾಲು ನೋವಾಗುತ್ತಿದೆ.,ಅವನ ಎಡ ಕಾಲು ಮುರಿದಿದೆ.,ಕಾಲ,ಕಾಲ,1,1,2,2.0,1,synthetic_examples
pair_0202,,,ಕಾಲ ನೋಡುತ್ತಿರುವುದೇ ಅದು.,ಕಾಲದ ಸಮಯ ನಿಗದಿತವಾಗಿದೆ.,ಕಾಲ,ಕಾಲ,1,1,3,3.0,1,synthetic_examples
pair_0203,,,ಕಾಲದ ಸಮಯ ನಿಗದಿತವಾಗಿದೆ.,ಕಾಲ ನೋಡುತ್ತಿರುವುದೇ ಅದು.,ಕಾಲ,ಕಾಲ,1,1,3,3.0,1,synthetic_examples
pair_0204,,,ಕಾಲ ಬಟ್ಟೆ ಧರಿಸಿ.,ಕಾಲ ಮೇಘ ಗಾಳಿ ಬೀಸುತ್ತಿದೆ.,ಕಾಲ,ಕಾಲ,1,1,4,4.0,1,synthetic_examples
pair_0205,,,ಕಾಲ ಮೇಘ ಗಾಳಿ ಬೀಸುತ್ತಿದೆ.,ಕಾಲ ಬಟ್ಟೆ ಧರಿಸಿ.,ಕಾಲ,ಕಾಲ,1,1,4,4.0,1,synthetic_examples
pair_0206,,,ಮುಂಗಾರು ಕಾಲ ಮೂವೆತ್ತೆ ಅಂದಾಗೆ ಬರುತ್ತದೆ.,ಬೇಸಿಗೆ ಕಾಲ ತುಂಬಾ ಬಿಸಿಯಾಗಿರುತ್ತವೆ.,ಕಾಲ,ಕಾಲ,1,1,5,5.0,1,synthetic_examples
pair_0207,,,ಅವಕಾಶ ಕಾಲೆ ಮಾಡಿದೆ.,ಅನ್ನ ಕಾಲೆ ಮಾಡಬೇಡ.,ಕಾಲೆ,ಕಾಲೆ,1,1,1,1.0,1,synthetic_examples
pair_0208,,,ಪ್ರತಿಭೆ ಕಾಲೆ ಮಾಡಬೇಡ.,ಹಣ ಕಾಲೆ ಮಾಡುವುದು ನೀತಿಹೀನ.,ಕಾಲೆ,ಕಾಲೆ,1,1,2,2.0,1,synthetic_examples
pair_0209,,,ಪರಿವಾರ ಕಾಲೆ ಮಾಡುವುದು ಅನುಚಿತ.,ಅಧ್ಯಯನ ಕಾಲೆ ಮಾಡಿದೆ.,ಕಾಲೆ,ಕಾಲೆ,1,1,3,3.0,1,synthetic_examples
pair_0210,,,ಕಿರಿಯ ವಿವರಣೆ ಸ್ಪಷ್ಟ.,ಕಿರಿಯ ಸಮಸ್ಯೆ ಛಿದ್ರ ಪಟ್ಟು.,ಕಿರಿಯ,ಕಿರಿಯ,1,1,1,1.0,1,synthetic_examples
pair_0211,,,ಕಿರಿಯ ವಯಸ್ಸು ಅಮೂಲ್ಯ.,ಕಿರಿಯ ಮಗು ನೆಲೆಯಲ್ಲಿ.,ಕಿರಿಯ,ಕಿರಿಯ,1,1,2,2.0,1,synthetic_examples
pair_0212,,,ಕಿರಿಯ ಸಹೋದರ ಸಹಾಯಕ.,ಕಿರಿಯ ಪದ ತೃಪ್ತ ವೈತನಿಕ.,ಕಿರಿಯ,ಕಿರಿಯ,1,1,3,3.0,1,synthetic_examples
pair_0213,,,ಕಿರಿಯ ಪದ ತೃಪ್ತ ವೈತನಿಕ.,ಕಿರಿಯ ಸಹೋದರ ಸಹಾಯಕ.,ಕಿರಿಯ,ಕಿರಿಯ,1,1,3,3.0,1,synthetic_examples
pair_0214,,,ನೋವಿನಿಂದ ಕೂಲಿ ಮಾಡಿದಾಳು.,ಪರೋಪಕಾರಿ ಉದ್ದೇಶದಿಂದ ಕೂಲಿ ಮಾಡುತ್ತೆ.,ಕೂಲಿ,ಕೂಲಿ,1,1,1,1.0,1,synthetic_examples
pair_0215,,,ನನ್ನನ್ನು ಕೂಲಿ ಮಾಡಿದಾಳು.,ಮಗುವನ್ನು ಕೂಲಿ ಮಾಡಿ.,ಕೂಲಿ,ಕೂಲಿ,1,1,2,2.0,1,synthetic_examples
pair_0216,,,ನಿನ್ನ ಸ್ನೇಹಿತರನ್ನು ಕೂಲಿ ಮಾಡೋ.,ಪಾರ್ಟಿಗೆ ಮಹತ್ತರ ಕೂಲಿ ಮಾಡಿದೆ.,ಕೂಲಿ,ಕೂಲಿ,1,1,3,3.0,1,synthetic_examples
pair_0217,,,ನನಗೆ ನೀರು ಕೊಡಿ.,ಆನೆಗೆ ಒಣಹೂವು ಕೊಡಿ.,ಕೊಡು,ಕೊಡು,1,1,1,1.0,1,synthetic_examples
pair_0218,,,ಅತಿಥಿಗೆ ಆಸನ ಕೊಡಿ.,ದೇವರಿಗೆ ಹೂವು ಕೊಡುವುದು ಸಂಪ್ರದಾಯ.,ಕೊಡು,ಕೊಡು,1,1,2,2.0,1,synthetic_examples
pair_0219,,,ತೊಡೆಯಿಂದ ಥಳಿ ಕೊಟ್ಟನಳೆ.,ಶತ್ರುವಿಗೆ ಭೀಷಣ ಪ್ರಹಾರ ಕೊಡುತ್ತೆ.,ಕೊಡು,ಕೊಡು,1,1,3,3.0,1,synthetic_examples
pair_0220,,,ಕ್ಷೇತ್ರ ಸಂಪೂರ್ಣ ಫಸಲಿ ಕೊಡುತ್ತಿದೆ.,ಗಿರುಗಳ ಹಾಕುಮಾರಿ ಬೆಳ್ಳಳಿ ಕೊಡುತ್ತವೆ.,ಕೊಡು,ಕೊಡು,1,1,4,4.0,1,synthetic_examples
pair_0221,,,ಮಜ್ಜಿಗೆ ಗಟ್ಟ ಕಕ್ಷ.,ಗಟ್ಟ ಕಲ್ಲು ಚಾಪುತ್ತಾರೆ.,ಗಟ್ಟ,ಗಟ್ಟ,1,1,1,1.0,1,synthetic_examples
pair_0222,,,ಗಟ್ಟ ನಿಯಮ ಪಾಲಿಸುತ್ತಾರೆ.,ಗುರುವು ಗಟ್ಟ ಆಜ್ಞೆಕಾರಿ.,ಗಟ್ಟ,ಗಟ್ಟ,1,1,2,2.0,1,synthetic_examples
pair_0223,,,ಗಟ್ಟ ಅನುಸಾರ ನೋವು.,ಗಟ್ಟ ಸಮಸ್ಯೆ ಎದುರಾಗಿದೆ.,ಗಟ್ಟ,ಗಟ್ಟ,1,1,3,3.0,1,synthetic_examples
pair_0224,,,ಗುರುತ್ವ ಕಾಚು ಕೆಲಸ.,ಗುರುತ್ವ ಸಮಸ್ಯೆ ಪರಿಹಾರ.,ಗುರುತ್ವ,ಗುರುತ್ವ,1,1,1,1.0,1,synthetic_examples
pair_0225,,,ಗುರುತ್ವ ಸಮಸ್ಯೆ ಪರಿಹಾರ.,ಗುರುತ್ವ ಕಾಚು ಕೆಲಸ.,ಗುರುತ್ವ,ಗುರುತ್ವ,1,1,1,1.0,1,synthetic_examples
pair_0226,,,ಗುರುತ್ವ ನಿರ್ಧಾರ ಕೆಳಗಿಳಿಸಲಾಯಿತು.,ಗುರುತ್ವ ಕಾರ್ಯಭಾರ ತಿಳಿಸಲಾಯಿತು.,ಗುರುತ್ವ,ಗುರುತ್ವ,1,1,2,2.0,1,synthetic_examples
pair_0227,,,ಗುರುತ್ವ ಕಾರ್ಯಭಾರ ತಿಳಿಸಲಾಯಿತು.,ಗುರುತ್ವ ನಿರ್ಧಾರ ಕೆಳಗಿಳಿಸಲಾಯಿತು.,ಗುರುತ್ವ,ಗುರುತ್ವ,1,1,2,2.0,1,synthetic_examples
pair_0228,,,ಗುರುತ್ವ ಸಂಜೆಯಲ್ಲಿ ಆರಾಧನೆ.,ಗುರುತ್ವ ನೀತಿ ಅನುಷ್ಠಾನ.,ಗುರುತ್ವ,ಗುರುತ್ವ,1,1,3,3.0,1,synthetic_examples
pair_0229,,,ಗುರುತ್ವ ನೀತಿ ಅನುಷ್ಠಾನ.,ಗುರುತ್ವ ಸಂಜೆಯಲ್ಲಿ ಆರಾಧನೆ.,ಗುರುತ್ವ,ಗುರುತ್ವ,1,1,3,3.0,1,synthetic_examples
pair_0230,,,ಮೊಟೊರಿನ ಚಕ್ರ ತಿರುಗುತ್ತಿದೆ.,ರಥದ ಚಕ್ರ ಭಾರೀ ಮರದಿಂದ ತಯಾರಾಗಿದೆ.,ಚಕ್ರ,ಚಕ್ರ,1,1,1,1.0,1,synthetic_examples
pair_0231,,,ಋತುಗಳ ಚಕ್ರ ಪುನರಾವೃತ್ತಿಯಾಗುತ್ತಿದೆ.,ಜೀವನದ ಚಕ್ರ ಮುಂದುವರಿದುಕೊಂಡಿದೆ.,ಚಕ್ರ,ಚಕ್ರ,1,1,2,2.0,1,synthetic_examples
pair_0232,,,ಹೃದಯ ಚಕ್ರ ಸಕ್ರಿಯಗೊಳಿಸುತ್ತಾರೆ.,ಯೋಗದಲ್ಲಿ ಆಚ್ಠ ಚಕ್ರಗಳು ಮುಖ್ಯ.,ಚಕ್ರ,ಚಕ್ರ,1,1,3,3.0,1,synthetic_examples
pair_0233,,,ಸುದರ್ಶನ ಚಕ್ರ ಸಕಲವನ್ನು ನಾಶಮಾಡುತ್ತಿದೆ.,ಕೃಷ್ಣನ ಚಕ್ರ ವೈಷ್ಣವ ಅಸ್ತ್ರ.,ಚಕ್ರ,ಚಕ್ರ,1,1,4,4.0,1,synthetic_examples
pair_0234,,,ಚಿತ್ರ ತೆಗೆಯಬೇಕೆ?,ಆ ಚಿತ್ರ ನೈಜತ್ವವನ್ನು ಪ್ರತಿಬಿಂಬಿಸುತ್ತದೆ.,ಚಿತ್ರ,ಚಿತ್ರ,1,1,1,1.0,1,synthetic_examples
pair_0235,,,ಈ ಕಾದಂಬರಿಯು ಚಿತ್ರವಾದ ಪ್ರಕರಣಗಳನ್ನು ಹೊಂದಿದೆ.,ಸಮಾಜದಲ್ಲಿ ಅನೇಕ ಚಿತ್ರ ಜನತೆ ವಾಸ ಮಾಡುತ್ತಾರೆ.,ಚಿತ್ರ,ಚಿತ್ರ,1,1,2,2.0,1,synthetic_examples
pair_0236,,,ಚಿತ್ರವಾದ ಸಂಗತಿ ಸಂಭವಿಸಿದೆ.,ಆ ಚಿತ್ರ ಘಟನೆ ಕೇಳಲು ಅದ್ಭುತವಾಗಿದೆ.,ಚಿತ್ರ,ಚಿತ್ರ,1,1,3,3.0,1,synthetic_examples
pair_0237,,,ಈ ಚಿತ್ರ ಶಿಲ್ಪ ಅಸಾಧಾರಣ ಕಾದಂಬರಿ.,ರವಿಶಂಕರ ಸುಂದರ ಚಿತ್ರ ಸೃಷ್ಟಿಸುತ್ತಾರೆ.,ಚಿತ್ರ,ಚಿತ್ರ,1,1,4,4.0,1,synthetic_examples
pair_0238,,,ನೀರಾಯ ಜಲ ಕುಡಿಯಿರಿ.,ಜಲ ಬೆಳಗಿನ ಬಿಸಿಯಲ್ಲಿ ಕುದಿಯುತ್ತಿದೆ.,ಜಲ,ಜಲ,1,1,1,1.0,1,synthetic_examples
pair_0239,,,ಜಲ ಬೆಳಗಿನ ಬಿಸಿಯಲ್ಲಿ ಕುದಿಯುತ್ತಿದೆ.,ನೀರಾಯ ಜಲ ಕುಡಿಯಿರಿ.,ಜಲ,ಜಲ,1,1,1,1.0,1,synthetic_examples
pair_0240,,,ತೈಲಜಲ ಸಲ್ಯ ಹೀಲಿಂಗಿಗೆ ಉಪಯುಕ್ತ.,ಕಷಾಯ ಜಲ ಔಷಧ.,ಜಲ,ಜಲ,1,1,2,2.0,1,synthetic_examples
pair_0241,,,ಕಷಾಯ ಜಲ ಔಷಧ.,ತೈಲಜಲ ಸಲ್ಯ ಹೀಲಿಂಗಿಗೆ ಉಪಯುಕ್ತ.,ಜಲ,ಜಲ,1,1,2,2.0,1,synthetic_examples
pair_0242,,,ಜಲದಲ್ಲಿ ಬೆನ್ನು ಬದ್ಧವಾಗುತ್ತಿದೆ.,ಜಲ ತೂರುವ ಹೀನಾಭಿಮಾನ ನಿವಾರಿಸುವುದು ಕಷ್ಟ.,ಜಲ,ಜಲ,1,1,3,3.0,1,synthetic_examples
pair_0243,,,ಜಲ ತೂರುವ ಹೀನಾಭಿಮಾನ ನಿವಾರಿಸುವುದು ಕಷ್ಟ.,ಜಲದಲ್ಲಿ ಬೆನ್ನು ಬದ್ಧವಾಗುತ್ತಿದೆ.,ಜಲ,ಜಲ,1,1,3,3.0,1,synthetic_examples
pair_0244,,,ಹಾಕುಮಾರಿಗೆ ನಕ್ಷತ್ರ ತೆಗೆದು ಕೊಟ್ಟರು.,ನನ್ನ ಹಸ್ತ ತೆಗೆ.,ತೆಗೆ,ತೆಗೆ,1,1,1,1.0,1,synthetic_examples
